char,source,text,keywords,context,count,cluster
illidan,PDFs/illidan.pdf,"fel orcs grew afraid of her fury as she built a mountain of corpses around herself. Then
one of them, braver than the rest, threw himself back into the fray, and the army
descended upon her. She choppe d and choppe d until her arm grew weary. She bled from
a thousand cuts. She knew she was going to die, and if she could not get the Betrayer,
she was going to drag as many of his henchmen dow n with her as she could.
Blinded by weariness and the blood and sweat dripping down her face, she still
la",['power'],,1,1
illidan,PDFs/illidan.pdf,"CHAPTER SEVENTEEN
Three Months Before the Fall
AKAMA WATCHED THE PORTAL OPEN FROM AMID THE rocks high on the slopes of the Hand
of Gul’dan. He had seen many gateways, but nothing like this one. It was not just the
scale that was daunting. It was the sheer power. It had devoured the souls of hundreds,
sucked in all the magical energy for leagues around. He could feel the unholy strength of
it even from his vantage point on the cliffs. What was Illidan up to? He had told his
council that this was ",['power'],daunting. It was the sheer power. It had devoured the souls,1,1
illidan,PDFs/illidan.pdf,"to deliver Maiev into Illidan’s hands, and for that he was sorry. She had trusted him, and
he had placed her into the clutches of her archenemy.
Even now Illidan stood triumphant over his former captor. He did not look as if he
intended to kill her. No. He had something else in mind. He had endured much at the
hands of Maiev Shadowsong. She had become a focus for his rage and his hatred and
his grievances. He would not grant her a quick death.
Illidan’s great spell shrieked to a climax.
Akama fe",['power'],,1,1
illidan,PDFs/illidan.pdf,"* * *
ILLIDAN TURNED MAIEV’S ARMORED form over with the tip of his hoof. She was skilled
and powerful, of that there was no doubt. Looking at the carnage she had wrought among
his forces, he had almost been tempted to take a hand in the fight himself. He had feared
that she might break free and escape once more into the tortured landscape of
Shadowmoon Valley.
He was glad now he had decided to deploy an entire army to watch over the gate. It
had proved necessary before the way was opened.
She ha",['power'],"hoof. She was skilled and powerful, of that there was no",1,1
illidan,PDFs/illidan.pdf,"CHAPTER EIGHTEEN
Three Months Before the Fall
VANDEL BOUNDED THROUGH THE GATEWAY, FOLLOWING Illidan. He raced to the brow of
the ridge and crouched down, doing his best to keep out of sight. In the distance he
sensed demons, thousands upon thousands of them.
Huge islands of rock drifted like clouds across the sky of this alien world. Green
light burned from every boulder and blazed from the tiny orbiting sun. Beneath him, the
ridge fell away to a cratered plain over which obelisks of reflective ",['sacrifice'],,1,1
illidan,PDFs/illidan.pdf,"He will fail, Vandel’s inner demon whispered. He has always failed. He cannot
oppos e the will of Sargeras. Nothing can.
Vandel took a deep breath and tried to empty his mind. It did not help. It just made
him more aware of the magical energy surging around him. He wanted to gather it to him
and use it. He wanted to unleash a volcanic tide of destruction upon the distant demonic
presences. He wanted to slay them and take their essence into himself. He wanted to
feed.
Yes, the demon whispered. Th",['power'],,1,1
illidan,PDFs/illidan.pdf,"For a moment, the Legion’s army slowed, as if unable to comprehend the fact that it
was being attacked by this much smaller force of smaller beings. One or two of the
dreadlords laughed again.
With a roar like the ocean throwing itself against rocks, the two armies collided. The
demons wanted to reach the portal and close it. The demon hunters wanted only to slay
and slay and slay.
A felhound leapt at Vandel. Sharklike teeth gaped. He invoked his power and sent a
bolt of greenish-yellow energy i",['power'],teeth gaped. He invoked his power and sent a bolt of,1,1
illidan,PDFs/illidan.pdf,"* * *
ILLIDAN WATCHED HIS FORCES drag down the last of the nathrezim. His doubts had
disappeared. The demon hunters had exceeded his expectations. Of course, they had
possessed the advantage of surprise. The dreadlords had not expected to encounter such
savage power so close to their home, and overconfidently had marched to meet them.
Things would not always be so easy.
Nonetheless, nothing could damp the sweet feeling of triumph. Every dreadlord who
fell here would be one who no longer troubled",['power'],"expected to encounter such savage power so close to their home,",1,1
illidan,PDFs/illidan.pdf,"the doorway once was, baffled. What had been an empty archway mere heartbeats
before was now a wall of stone.
“Blast it,” Illidan ordered. There was no doubt an easier way of opening the
doorway, but he did not have time to uncover the magical key. The demon hunters raised
their hands and sent fel flame licking toward the barrier. Hundreds of bolts smashed,
scoured, and scratched the stone, but still it withstood t he assault.
“Concentrate on one area!” Illidan shouted, and all the bolts converg",['power'],,1,1
illidan,PDFs/illidan.pdf,"forces were engaged with enemy reinforcements flooding in from the city above . He
prayed they could hold them until his work was completed. He needed to finish quickly,
or this library would become a trap and his army would be overwhelmed by the massed
strength of the nathrezim.
He took a deep breath and slowed his pulse. It would not do to make a mistake here,
so close to the culmination of everything he had planned for. He could not afford to fail.
There—he found the first ward, a complex spe",['power'],,1,1
illidan,PDFs/illidan.pdf,"ILLIDAN WATCHED THE LAST remnants of the portal’s energies collapse behind him. He
looked at his army and wondered if there were any spies among it. Almost certainly it
was the case. He considered the events of the day, and his mouth twisted into a wide
grin.
Today had been the first unalloyed triumph he had experienced in many a long
century. He had captured Maiev. He had invaded the realm of the dreadlords and
acquired their most closely kept secret. He had destroyed the armies they had sent t","['power', 'justice']",,2,1
illidan,PDFs/illidan.pdf,"CHAPTER TWENTY
Three Months Before the Fall
MAIEV WOKE. SHE ACHED AS SHE HAD EVERY one of the days since she had found herself
in this place. She was somewhere deep underground. Nearby she could hear water drip.
The air held the brimstone taint of demons, and the unwashed smell of Broken.
She rose to her feet and tested the bars of her cage once more. They had not become
any weaker since the previous day. They had been forged to hold something with the
power of a pit lord, and then they had been",['power'],"to hold something with the power of a pit lord, and",1,1
illidan,PDFs/illidan.pdf,"that she could be so easily gulled. Akama must have meant some of what he said. His
resentment of what the Betrayer had don e to the Temple of Karabor was real enough.
Looking back, she could see there was a moment when he had changed. At their last
meeting in Orebor Harborage, he had seemed even more aged, weaker, and listless.
Perhaps he had been finally unmasked, captured, tortured. Perhaps Illidan had used
some pow erful binding spell on him.
Or perhaps Illidan had simply made him a better o",['justice'],,1,1
illidan,PDFs/illidan.pdf,"“I would never be like him.”
“You are more like him than you can possibly know. You are just as ruthless and just
as obsessed. You sacrificed your friends without a second thought when it suited your
purpose. You sacrificed the lives of all your followers.”
Maiev wanted to strike him but the bars restrained her. She glared at his lined face
and said, “I do not accept your judgments, Akama. I have learned not to trust anything
you say.”
“You can tell yourself that if you like, but look into your ","['sacrifice', 'freedom']",it suited your purpose. You sacrificed the lives of all your | and just as obsessed. You sacrificed your friends without a second,2,1
illidan,PDFs/illidan.pdf,"“I think the Burning Legion has finally worked out what I am doing.”
“How would they do that, Lord?”
“Perhaps they have spies left in our ranks. Only one of these canisters contains the
helstones I seek. The rest are filled with rocks.”
“How can you tell?”
“Use the sight the ritual gave you.”
Vandel concentrated on the metal cylinders and saw immediately what his overlord
had meant. One of them blazed with contained energy as if filled to the brim with
scintillant crystals. The others did not bu",['power'],,1,1
illidan,PDFs/illidan.pdf,"An enormous figure emerged, flanked by two blazing infernals.
He looked like a doom guard, Vandel thought, but larger. He had horns like a tauren,
massive, bison-like. Huge wings draped his back. Yellow demonic runes glared on his
bracers. In his right hand he clutched a gigantic black blade on which runes pulsed in
subdued blue. The sword looked large enough to take down an Ashenvale oak with one
swipe.
“So you are the one who defeated Magtheridon,” the demon said. “You don’t look
like much.”
H",['power'],,1,1
illidan,PDFs/illidan.pdf,"It bounded forward to attack even as Kruul sent a bolt of dark energy hurtling toward
Illidan. The lord of Outland leapt into the air and avoided it. It smashed into the rocks
behind where he had stood. They turned to dust, as if they had suffered a million years
of erosion in a moment.
Vandel found himself face-to-face with Kruul’s demonic pet. Its jaws gaped. Lava
bubbled within them.
The infernals lumbered toward him. Vandel vaulted over the core hound. His feet
briefly touched the hot metal ",['power'],,1,1
illidan,PDFs/illidan.pdf,"raised his blade, pointed it at Illidan, and sent another titanic bolt of shadowy energy
blazing up at his oppon ent. Illidan deflected it with a counterspell.
A low growl from behind told Vandel that the core hound had returned to seek prey.
He flipped himself around to face it. Half of one of its heads had been torn away.
Molten ichor spilled from several wounds in its side.
Still the creature’s unnatural vitality kept it moving. It bounded toward him, mouths
gaping, flames leaking around its ",['power'],,1,1
illidan,PDFs/illidan.pdf,"clambered across the battlements and looked out across the plains toward Warden’s
Cage, where Maiev Shadowsong was imprisoned. But the Grand Promenade was the
place he liked the best.
The fountains tinkled. It was the sound of running water that first attracted him, and
the scent of plants, some of them familiar from the forests of Ashenvale. It reminded him
of home, of the night elf he had once been. It was a sweet torment. It brought back
memories of his family. There were times when that calm",['power'],,1,1
illidan,PDFs/illidan.pdf,"Broken and grew into something vast and powerful and terrible. Not something to be
mocked by sin’dorei aesthetes.
Menace filled the night, and the blood elves froze like rabbits seeing the shadow of
an owl. For a moment, all was still, and a premonition of violence hung in the air. Then
Akama shrugged and smiled and made a gesture of benediction like a senile old priest
blessing a group of children. He hobbled away.
The blood elves were silent for a long time after that. Vandel stole away, wonde",['power'],grew into something vast and powerful and terrible. Not something to,1,1
illidan,PDFs/illidan.pdf,"They could not look into the secret chambers of his mind, where his thoughts were
still his own. He kept them shielded even in his sleep. Not even Illidan could look
within those warded areas.
At least that was what he told himself. There were times when he wondered whether
the spell that bound him also deceived him. Perhaps it allowed him these illusions of
freedom, all the better to lull him into submission. Perhaps Akama was more like his
people than he knew. Perhaps he was, after all, the pe",['freedom'],"allowed him these illusions of freedom, all the better to lull",1,1
illidan,PDFs/illidan.pdf,"Their enemies were too numerous and too powerful, and they were merely throwing
away resources that would be needed to defend the Black Temple when the final attack
came.
Illidan’s boast that he was going to take the war to Kil’jaeden also seemed pointless
now, no more threatening than a child dressing up in his father’s armor and waving his
father’s sword would be to a veteran soldier.
Vandel looked from face to face. Illidan’s wore a sneer, as if this whole vast army
was beneath his contempt. ",['power'],"were too numerous and too powerful, and they were merely throwing",1,1
illidan,PDFs/illidan.pdf,"He was a demon hunter, loyal to the Betrayer, but his war was against the Burning
Legion, not against folk who had once been his kin. He was not their enemy, even if they
thought they were his.
What would he do, t hen?
The answer was simple. If he was ordered to, he would fight. If kaldorei attacked
him, he would kill them. Otherwise he would try to avoid them.
More and more soldiers swept down the Stair of Destiny, a flood of armored flesh.
A tidal wave of violence that carried all before it. J",['power'],,1,1
illidan,PDFs/illidan.pdf,"had no more power left to draw on and even the gibbering demon voice in his head was
silenced.
He knew now that he was going to die, and he did not really care. He would sell his
life dearly, taking as many demons into death with him as he could. For the first time in
months, he felt like a mortal elf, weary and slow. The demons came on relentless,
unstoppa ble. The tide of battle carried him back toward the doom guard. Once more he
found himself face-to-face with Kruul.
Vandel ducked the swing ",['power'],had no more power left to draw on and,1,1
illidan,PDFs/illidan.pdf,"CHAPTER TWENTY-FOUR
Two Months Before the Fall
STREAMS OF MOLTEN GREEN LAVA FLOWED DOWN cliffs of shattered basalt. The air blazed
with heat and fel magic. It tingled on Illidan’s skin, filled his lungs with every breath.
He glanced around and noted that on every boulder, every ledge, every shard of rock
that stabbed at the sky, a demon hunter stood g uard.
They had driven off the Legion guards, but there was every chance the ritual he was
about to perform would draw the attention of the demons’",['power'],,1,1
illidan,PDFs/illidan.pdf,"Archimonde, a mad warlord consumed with fury and rage, Sargeras’s fist; Kil’jaeden,
the schemer, so adept at corrupting so many.
Who was Illidan to set himself against the likes of that awful trio? He touched the
Seal of Argus, running his claws over the indentations of the runes until the cool metal
squeaked. It was odd t hat it could stay so cold even here amid all the fire and fury.
He passed around the edge of the sorcerous circle he had created, checking the
wards, making sure that the ener",['power'],,1,1
illidan,PDFs/illidan.pdf,"cruel. A darkness broode d ove r the place, and a sense of corruption and loss.
The seal pulsed in his claws. It was no longer the real disk but a representation of it,
built from the magical energies of his spell, and it drew him downward to what he
sought. The tug was almost irresistible and yet he fought against it, studying the sky,
noting the position of stars and constellations, fixing them in his mind. Desperately he
sought familiar signs in the sky, knowing that he could use them to plot",['corruption'],"place, and a sense of corruption and loss. The seal pulsed",1,1
illidan,PDFs/illidan.pdf,"His spirit zoomed through the streets with the velocity of thought. He tried to slow
himself down, to get things under control, to stop himself from being reeled in too
swiftly. He forced himself to halt by the walls of the palace.
He sensed another presence. Something lurked close by, studying him. He extended
all his senses to the ultimate. There was something there, but he could not quite pin it
down. It was as shielded as he was. A sentinel? Or something else? He forced himself
to watch and ",['power'],,1,1
illidan,PDFs/illidan.pdf,"him dearly in the long run. Without the pit lord’s blood, there would be no more fel orcs
for his legions.
Except the long run no longer mattered. Things would be settled soon, and they
would not be settled in Outland but on Argus. He had the true location of Kil’jaeden’s
homeworld, but he had found it in spirit form. Now he needed to be able to transport an
army there in the flesh. It would take power to open such a portal, vast amounts of
power. Only one source of such was available to him. He",['power'],"a portal, vast amounts of power. Only one source of such | the flesh. It would take power to open such a portal,",1,1
illidan,PDFs/illidan.pdf,"their lives for a few more months or years. The end was coming for them all, unless
Kil’jaeden was defeated, unless the Burning Legion was destroyed.
It was not their fault that they saw only the smallest details of the overall picture. He
had never really troubled himself to convince them otherwise. He had relied on their
ambitions, their greed, the things he could offer them to keep them loyal. It was time he
let the others know how things stood.
“We need to take the war to Kil’jaeden,” he sai",['power'],,1,1
illidan,PDFs/illidan.pdf,"armoring himself against doubt, forcing himself only to ask questions that were relevant
to his struggle. Now, in this empty chamber, he could hear only the echoes of voices no
longer speaking.
Both Vandel’s doubts and Akama’s were justified. It was possible he was wrong. It
was possible that he was as insane as he had often been accused of being. He picked up
one of the pieces—an orc warrior carved from clefthoof ivory—and turned it over and
over in his fingers. How many fel orcs had he sent to",['sacrifice'],,1,1
illidan,PDFs/illidan.pdf,"some terrible weapon on the place, and the resulting evil energies had warped
everything within it.
Illidan knew the truth. He had inherited it from Gul’dan’s memories when he
consumed the power in his skull. The old schemer had dispatched a group of warlocks
to the city in search of artifacts buried there. The survivors had told him that something
had gone wrong and they had summoned a strange entity. It had shattered Auchindoun,
smashing the great dome, scattering the remains of countless dead",['power'],memories when he consumed the power in his skull. The old,1,1
illidan,PDFs/illidan.pdf,"A massive pile of bones sprang up as they passed, knitting themselves together into
animated skeletons, their fleshless fingers clutching weapons that perhaps they had
borne in life.
On ledges around the walls of the vault, robed draenei wove dark magic. Their
power connected with unlife, but the ones tapping it were living. Their necromancy
drew the dead to life. Illidan dispatched fel orcs to cut them dow n.
Slowly they fought their way into the center of the crypt. As they did so, the silvery",['power'],"draenei wove dark magic. Their power connected with unlife, but the",1,1
illidan,PDFs/illidan.pdf,"they came on in seemingly endless numbers. As they distracted the fel orcs, bolts of
shadow magic flew from the necromancers.
Worst of all were the spirits. They slithered through unseen, their cold, spectral
hands grasping fel orc bodi es and sucking the life out of them, leaving chilled corpses to
drop to the ground.
Illidan continued to wake the soul siphon to its full power. He forced himself to
concentrate, knowing that he did not have much time. The fel orcs could not hold up
under this pr",['power'],"soul siphon to its full power. He forced himself to concentrate,",1,1
illidan,PDFs/illidan.pdf,"CHAPTER TWENTY-SEVEN
One Day Before the Fall
ILLIDAN SAT ON THE THRONE IN HIS COUNCIL chamber. It had been weeks since his return
from Auchindoun and still he was weak. His power had not returned to anything like
what it had been before his use of the soul siphon.
Not for the first time, he considered dispatching an expedition to root out the
necromancers. He could not waste the resources. He looked at the great map table. His
armies were shattered. His empire, crumbling. Among them, the Allianc",['power'],still he was weak. His power had not returned to anything,1,1
illidan,PDFs/illidan.pdf,"themselves capable of ruling it and even reclaiming what was lost. Perhaps they were
right about that.
It did not matter. Illidan resented being here, resented having to go through with this
charade. Every minute spent placating his advisers was a minute not used finalizing his
plans to end the threat of the Burning Legion. He forced himself to look around the
room. Every one of those present had to meet the baleful pow er of his eyeless gaze.
High Nethermancer Zerevor spoke first. “The news fro",['power'],,1,1
illidan,PDFs/illidan.pdf,"find a way to ensure that it would remain steady once they passed through it. There was
so much to be done.
“What do y ou think, Lord?” Gathios asked. “What should we do?”
Suddenly he was tired of all this. He was tired of listening to this petty, pointless
bickering over matters that were no longer of any concern to him. He was tired of the
feeling of weakness and lassitude that filled him.
Time was running out and he had important work to do and this was a needless
distraction.
Illidan dismiss",['power'],,1,1
illidan,PDFs/illidan.pdf,"mark the portal’s opening, leapt from the engines. The lines of truesilver shimmered. A
mirror image of their pattern appeared in the air above  them, projected from the Seal of
Argus. He let his spirit exit his weary body .
It was easier to let go, as if using the soul siphon in Auchindoun had somehow
weakened the link between his spirit and his flesh. He reached out and wove the flows
of energy from the pattern into subtle threads, then gathered them to his spirit.
He followed the intricate pa",['power'],,1,1
illidan,PDFs/illidan.pdf,"with immense curiosity, but when he sought out the source, he could not find it.
Wait. What was that? That faint aura of shimmering light. He focused on it, but even
as he did so, it vanished from his perception—as if the owner had somehow withdrawn
below the skin of the universe.
He needed to concentrate on the work at hand. He was distracted when he could
least afford to be. He flitted through the crystalline palace to a new location, a vast
chamber in which succubi danced for the amusement of",['power'],,1,1
illidan,PDFs/illidan.pdf,"skill in Azeroth or Outland, and they would be most unlikely to finish his work. What
else could he do, t hough? He had come this far. He needed to continue.
He steeled himself and invoked the last anchor for the spell. This was the most
dangerous moment. Instead of simply taking form and fading, this vortex sent out a pulse
of force, leaping to the farthest anchor and then the next, forming a great pentacle and
then filling in the complex web of runes until it had replicated the magical energy ",['power'],,1,1
illidan,PDFs/illidan.pdf,"“I would like to think I am somewhat more sentient than my warglaives.”
“That is what makes you dangerous.”
“So the universe has anointed me to slay Kil’jaeden.” His tone was sardonic, but
hope flickered inside Illidan. Perhaps, if what this naaru said was true, there was some
chance of victory after all.
The swirl of lights indicated a negative. “No. Your enemy is far greater than
Kil’jaeden. Greater even than Sargeras and his Burning Legion.”
“Wonderful,” Illidan said. “As if they were not str",['sacrifice'],,1,1
illidan,PDFs/illidan.pdf,"There was utter certainty in the naaru’s voice, and it communicated itself to Illidan.
For a moment, he felt the Light embrace him, and his heart was at rest. He had been
given a vision of redemption beyond any he had hoped for. Peace filled him as he
communed silently with the naaru. The moment lasted only a heartbeat, but when it
ended, Illidan felt as if it might have been a lifetime.
“You will be a hero,” said the naaru. “But there will be a price.”
“There always is.”
* * *
THE MOMENT ENDED.",['power'],,1,1
illidan,PDFs/illidan.pdf,"CHAPTER TWENTY-EIGHT
One Day Before the Fall
MAIEV LOOKED UP TO SEE AKAMA STANDING IN the door way of her cage once more.
“Have you come to dangle vain promises before me again?” she asked. It was
difficult to keep the bitterness from her voice. Akama limped closer, tilted his head to
one side, and gazed up into her face. Such was his intensity that she grew
uncomfortable, although she refused to show it.
“No,” he said. His tone revealed both his weariness and his fear. “How are you
feeling? Str",['power'],,1,1
illidan,PDFs/illidan.pdf,"might hold out there for years. His enemies might fall out among themselves. I have
known him for too long to think his dow nfall will be easy.”
“And yet you think he might be overthrown.”
“A small force of sufficient power could infiltrate the temple, if they were given the
appropriate aid.”
“And of course you are in a position to give such aid. Forgive me if I have some
trouble believing you. I seem to have heard a story like this before. Last time this tale
did not turn out so well for me or ",['power'],"“A small force of sufficient power could infiltrate the temple, if",1,1
illidan,PDFs/illidan.pdf,"hands would be.
“Are you frightened I am going to kill you?”
“I am frightened you are going to try.”
“And why should I not?”
“Because you are not stupid. Let us not play games with each other, Maiev
Shadowsong. You are free because I have set you free. You can indulge a childish thirst
for revenge or you can help me overthrow our true enemy.”
“I can do bot h.”
“No. You cannot. I alone can get you into the Temple of Karabor. I alone can guide
you to the Betrayer. Decide now whom you wish to kill.",['justice'],,1,1
