char,source,text,keywords,context,count,cluster
illidan,https://wowpedia.fandom.com/wiki/Illidan_Stormrage,"When we first were introduced to Malfurion and Illidan in Warcraft III, Malfurion objected fiercely to the idea of freeing Illidan, in the belief that his crimes were unforgivable and that he should stay locked up. When they were reunited Illidan was bitter about how he had been punished and Malfurion was disgusted to be in the same room as Illidan, still nursing a grudge over Illidan's betrayal. Illidan, who seemed to be the more forgiving one at the time, was eager to prove to his brother that the demons had no hold over him. Later, after Illidan used the powers of the Skull of Gul'dan for himself and took on a demonic appearance, Malfurion demanded to know where his brother was, implying he still had some affection for him. After Illidan revealed that he was the demon, Malfurion, rather than killing him simply banished him. Obviously, Malfurion knew Maiev Shadowsong would want Illidan imprisoned but still chose not to act. Rather than object, Illidan simply walked away. 
",['power'],"Later, after Illidan used the powers of the Skull of Gul'dan",1,1
illidan,https://wowpedia.fandom.com/wiki/Illidan_Stormrage,"I suggest you remain hidden until I say otherwise, these demons are too powerful to face head on and in full force.
",['power'],"otherwise, these demons are too powerful to face head on and",1,1
illidan,https://wowpedia.fandom.com/wiki/Illidan_Stormrage,"Such a foolish creature, trying to challenge us.  His rancid corpse will serve as a reminder to the Legion of the power of Illidan Stormrage.
",['power'],to the Legion of the power of Illidan Stormrage.,1,1
illidan,https://wowpedia.fandom.com/wiki/Illidan_Stormrage,"The Deceiver will stop at nothing to destroy our world. We must make any sacrifice necessary to end his reign.
",['sacrifice'],world. We must make any sacrifice necessary to end his reign.,1,1
illidan,https://wowpedia.fandom.com/wiki/Black_Temple,"In response Gul'dan and the Shadow Council decided to ignore the Shadowmoon clan's warnings about the Dark Star, an ancient god of the Void that was actually the fallen naaru K'ara. They conducted a ritual to call on the Dark Star in their war against the draenei and channeled it at Karabor. A pillar of Void energy ripped through the heavens and slammed down on Karabor, driving many draenei defenders to madness while many others died instantly. Velen called on his powers to keep the Void at bay and rally the survivors to Karabor's harbor, but the Dark Star had forever darkened Karabor, and it became known as the Black Temple and was taken by the orcs.[4] After their defeat, the captured draenei clerics of Karabor were marched out, told that they were to be taken to Hellfire Citadel as prisoners of war. The warlock Teron'gor murdered each and every last one of them in cold blood outside of the walls.[5] While Hellfire Citadel was Warchief Blackhand's capital, Karabor became the clandestine Shadow Council's seat of ruling.
",['power'],instantly. Velen called on his powers to keep the Void at,1,1
illidan,https://wowpedia.fandom.com/wiki/Black_Temple,"Kanrethad Ebonlocke and Jubeka Shadowbreaker infiltrated the Black Temple, evading the Ashtongue Deathsworn under Akama who had reclaimed the temple after Illidan's death. Entering the Shrine of Lost Souls, Kanrethad recognized it as the power source that allowed Illidan to control demons without their being corrupted by the fel energies endemic to the Legion, and theorized that it had been originally intended as the power source to replace the Sunwell when Kael'thas Sunstrider and his blood elves aligned with him. Since Illidan's death, it grew in strength and power, waiting to be harnessed. The two warlocks prepared a crystal to absorb the arcane magics within the Shrine, leaving it to do its work when they heard Ashtongue patrols hunting them.
",['power'],"been originally intended as the power source to replace the Sunwell | it grew in strength and power, waiting to be harnessed. The | Kanrethad recognized it as the power source that allowed Illidan to",1,1
illidan,https://wowpedia.fandom.com/wiki/Black_Temple,"Later adventurer who studied warlock magics soon came on their trail. Reclaiming the now-empowered crystal and taking it to the summit, the warlock witnessed the opening of a massive gateway, and from it stepped Kanrethad in a monstrous demonic form, utterly corrupted by absorbing too much fel energy. Though Kanrethad's powers were formidable, the warlock persevered long enough for Jubeka to arrive and fulfill Kanrethad's earlier request to banish him.[13]
",['power'],"on their trail. Reclaiming the now-empowered crystal and taking it to | much fel energy. Though Kanrethad's powers were formidable, the warlock persevered",1,1
illidan,https://wowpedia.fandom.com/wiki/Black_Temple,"Originally founded as a Draenei temple, this plot has been conquered and despoiled many times throughout the history of Outland, removing any spiritual grace it  may have once held. The Black Temple has been the stage of the Orc Horde's blood curse,  fortress for the then-mortal Ner'zhul, and a prime staging ground for the Burning Legion's campaign of destruction... Most recently, it has been claimed as home by Illidan, where he and his minions make their bid for power over the remnants of the shattered planet. Now, it is up to you to face the malefic forces of Illidan and his minions in hopes of freeing Outland from chaos and tyranny.
",['power'],minions make their bid for power over the remnants of the,1,1
illidan,https://wowpedia.fandom.com/wiki/Black_Temple,"For years the Shadow Council bloodied the Black Temple with foul demonic rituals, but after the Second War the dark spellcasters fell to the Alliance's devastating invasion of Draenor. The shaman Ner'zhul hastily opened several dimensional portals in order to stage a retreat, and the resulting magical backlash ripped the world apart. In what had become the fractured realm of Outland, Ner'zhul's portals were a strategic advantage that appealed to the demon general Magtheridon, who quickly seized the Black Temple as his seat of power.
",['power'],Temple as his seat of power.,1,1
thrall,https://wowpedia.fandom.com/wiki/Thrall,"Go'el is the son of Durotan, former chieftain of the Frostwolf clan, and Draka. He was born in the year 1 in their new home in the Alterac Mountains. Soon after the birth, Draka and the child accompanied Durotan to a secret meeting with Orgrim Doomhammer in Loch Modan.[15] While in Loch Modan, Durotan warned Orgrim about the treachery of the warlock Gul'dan and his Shadow Council who used the orcish race as vassals to their ambition for power. Soon after, Durotan and his family were escorted by Orgrim's personal bodyguards on their way home to the north when in truth, the guards were actually assassins loyal to Gul'dan and brutally murdered Durotan and Draka while leaving the infant Go'el to die helplessly in the wilderness.[16]
",['power'],"vassals to their ambition for power. Soon after, Durotan and his",1,1
thrall,https://wowpedia.fandom.com/wiki/Thrall,"Thrall was captured and taken to an internment camp run by one Lorin Remka. It was here that he met an old orc with glowing red eyes named Kelgar, who told him of the corruption of Gul'dan, and how the old ways had been so much better for the Horde. He told him that the only one still thinking of embracing this was the undefeated Grom Hellscream, Chieftain of the Warsong clan. When another orc told Thrall that Blackmoore had arrived at the camp looking for him, Thrall escaped again and sought out Grom Hellscream.[9]
",['corruption'],"who told him of the corruption of Gul'dan, and how the",1,0
thrall,https://wowpedia.fandom.com/wiki/Thrall,"After trekking to exhaustion, Thrall was rescued by the Frostwolves and taken to their camp. There he met Drek'Thar, who told Thrall that he was the son of the chieftain of the Frostwolves. Once Thrall had found his place among the Frostwolves, Drek'Thar taught him the old ways of the Horde, before Gul'dan's corruption, and soon Thrall was accepted as a member of the clan. A frost wolf named Snowsong eventually chose Thrall as her companion. It was some time after that choosing that he was called away by Drek'Thar, and came upon a quiet place where he had never been or seen before. Here he was to be initiated.
",['corruption'],"of the Horde, before Gul'dan's corruption, and soon Thrall was accepted",1,0
thrall,https://wowpedia.fandom.com/wiki/Thrall,"In one of the most spiritual experiences of his life, Thrall befriended the spirits of Earth, Air, Fire, Water, and the Wilds. He became the first new shaman since Gul'dan's vile corruption of the Horde. He returned to the camp a new orc and became fully immersed in the old ways and ancient rites of the shaman and his clan, learning how to wield the fury of the storms and earth,[17] and embracing his role as son of the chieftain. This was a significant and symbolic event since Thrall was the first shaman to be accepted by the spirits since Drek'Thar's time. Not only did this mean Thrall would be destined to be one of the greatest shaman in orcish history, but it also meant that the spirits finally forgave the orcish race for consorting with demonic powers, and deemed Thrall as the first of a brand new generation of shaman.
","['power', 'corruption']","race for consorting with demonic powers, and deemed Thrall as the | new shaman since Gul'dan's vile corruption of the Horde. He returned",2,0
thrall,https://wowpedia.fandom.com/wiki/Thrall,"Doomhammer named Thrall his second-in-command and explained his strategy for liberating the encampments. Per Doomhammer's plan, Thrall infiltrated the camps masquerading as one of the downtrodden, lethargic prisoners, and then riled the orcs up with shows of his shamanistic powers. With the downtrodden orcs revitalized by their restored heritage, they quickly overran the encampments. On the first three encampments, this proved to be an effective tactic. On the fourth, Thrall was too easily recognized, and thus they had to resort to the numbers of the new Horde — and the shamanistic powers wielded by Thrall — to liberate the encampment. At the fifth, they were even better prepared — knights from Durnholde had been stationed at the remaining encampments, so that whichever camp they attacked, there would be a greater resistance. During the liberation of this encampment — now the Horde outpost of Hammerfall in the Arathi Highlands — Doomhammer was killed, impaled from behind by a knight's lance. With his dying breath, he gave Thrall his black plate and warhammer, and named him Warchief of the Horde. He made sure to restore, but not replace, the back plate pierced by the lance that took Doomhammer's life;[18] and a symbol of the Frostwolf clan was added to the Doomhammer.
",['power'],Horde — and the shamanistic powers wielded by Thrall — to | with shows of his shamanistic powers. With the downtrodden orcs revitalized,1,0
thrall,https://wowpedia.fandom.com/wiki/Thrall,"Thrall's first action as Warchief was to attack Durnholde in an effort to dismantle the entire internment camp system. He secretly met with Taretha, asking her to leave Durnholde with her family, but she refused, hoping that it would never come to battle and fearful of the consequences if Blackmoore noticed her missing (Blackmoore had taken her as his mistress, an arrangement she had never been happy with). When Thrall arrived at Durnholde with the Horde at his back, he confronted a drunken Blackmoore and asked for a peaceful parlay in order to prevent useless bloodshed. Blackmoore went through a plethora of emotions — from amusement at Thrall's rise to power, anger at what the Warchief was demanding, and grief at how Thrall had supposedly betrayed him. Once again demanding that Blackmoore surrender or be killed; the master of Durnholde gave his response by tossing the severed head of Taretha Foxton into the courtyard, screaming that this was what he would do with traitors.
",['power'],"amusement at Thrall's rise to power, anger at what the Warchief",1,0
thrall,https://wowpedia.fandom.com/wiki/Thrall,"Thrall emerged shaken from the castle to find his orcs victorious. Thrall gave a message to Blackmoore's second-in-command, Lord Karramyn Langston, to take to his superiors: to free the remaining orcs, and to cede land for their use. If the Alliance would let them be, they would not trouble the Alliance and would be willing to engage in cooperation and trade. If the Alliance chose to fight them, they would have made an enemy the likes of which had never been seen before — making the old warlock-controlled Horde shrink to insignificance. He then left Durnholde after allowing Sergeant and the surviving humans to walk away unharmed and he had Tari's necklace delivered to her parents. When they were gone he called upon the Spirit of the Earth to destroy the keep before leading his people to freedom.[9]
",['freedom'],before leading his people to freedom.[9],1,0
thrall,https://wowpedia.fandom.com/wiki/Thrall,"Thrall later composed a lok'vadnod (""song of a hero"") to commemorate Taretha's sacrifice.
",['sacrifice'],"a hero"") to commemorate Taretha's sacrifice.",1,0
thrall,https://wowpedia.fandom.com/wiki/Thrall,"Halfway along their journey to Kalimdor, Thrall's ships were beset by a fierce storm near the Maelstrom and forced to take shelter on a small island. There the orcs met the troll leader, Sen'jin, who told them of a human outpost that attacked his tribe night and day on the island. Fearing for the Horde and the Darkspear Trolls' safety, Thrall and his warriors assaulted the human base. During his stay, he reactivated a Fountain of Health and discovered that the isle had active volcanos. Aided by the Darkspear trolls, the human leader, an archmage, was killed, but then many murlocs attacked the Horde, the humans, and the Darkspear trolls. While the orcish and human forces were occupied with one another, the piscine monsters sought out sacrifices for their rituals.[23]
",['sacrifice'],the piscine monsters sought out sacrifices for their rituals.[23],1,0
thrall,https://wowpedia.fandom.com/wiki/Thrall,"Thrall was then imprisoned within the murlocs' fiery dungeon. He learned from a troll head hunter, with whom he shared a cell, that the murlocs planned to sacrifice them both to a sea witch. Fortunately, though the murlocs were strangely advanced, they were unaware of Thrall's shamanistic abilities, and the warchief was able to escape and free his warriors. One grunt reported that Sen'jin was not in the cells — and that he was taken as the first sacrifice. Thrall raced to the altar but was forced to watch in horror as the murloc sorcerer killed Sen'jin. Thrall and his warriors were able to kill the three Murloc Guardians maintaining the magic barrier which prevented their escape and the Murloc Sorcerer, but it was too late for the troll leader. The dying Sen'jin revealed a vision — that Thrall would lead the Darkspear tribe to greatness. Thrall then offered the remaining trolls a place in the Horde for the kindness they had shown the orcs.[24]
",['sacrifice'],that the murlocs planned to sacrifice them both to a sea | was taken as the first sacrifice. Thrall raced to the altar,1,0
thrall,https://wowpedia.fandom.com/wiki/Thrall,"Thrall and Cairne separated and searched the caverns themselves. After much time, they found the Oracle's chamber, but they also found Jaina Proudmoore and were about to battle when the Oracle appeared, revealing himself to be the Prophet that Thrall and Jaina had met in Lordaeron. He told Thrall of Grom's corruption, and that the orcs and humans must join forces or be destroyed. Reluctantly, Thrall agreed, desperate to save Grom.[30]
",['corruption'],"He told Thrall of Grom's corruption, and that the orcs and",1,0
thrall,https://wowpedia.fandom.com/wiki/Thrall,"Thrall put an initial assault against Mannoroth, but was subdued quickly, and would have been killed, had Grom not gathered his strength and made a devastating blow against Mannoroth, shattering his plate and driving his axe deep into his belly. This was enough to kill the pit lord, but as Mannoroth died explosive energies burst forth from his body and hit Grom at point-blank range. The chieftain of the Warsong clan was mortally wounded. As the demonic, red haze lifted from the eyes of Grom Hellscream and his clan mates, Grom was told that he had freed himself. Thrall approached Grom telling to him that he had freed not just him, but all the orcs from demonic corruption.[32]
",['corruption'],all the orcs from demonic corruption.[32],1,0
thrall,https://wowpedia.fandom.com/wiki/Thrall,"Thrall, proud Warchief of the Horde remained in his palace, located in the Valley of Wisdom in Orgrimmar. He was considered the mightiest orc alive. He stood as warchief over the entire Horde, holding dominion over the Darkspear trolls and tauren tribes alike. His honor, cunning, and compassion have won him many allies over the years, even amongst the humans and night elves. Thrall lives to defend his people's freedom and ensure the safety of the extended Horde.[6]
",['freedom'],lives to defend his people's freedom and ensure the safety of,1,0
thrall,https://wowpedia.fandom.com/wiki/Thrall,"The Revantusk tribe learned about the new Horde and sent runners to Thrall. Thrall was wary of the trolls at first, but he came to see that the Revantusk trolls were unique among forest trolls in a fundamental way. The Revantusk tribe had never had much in the way of the fighters or resources, and so it had instead decided to specialize in the trickier art of negotiation. By the time they spoke with Thrall, the Revantusks had acquired a reputation for trustworthiness that was well deserved. The trolls were impressed by Thrall and his dream. Even so, they remembered the recklessness and corruption of the first Horde. Thus, the Revantusks declined to rejoin the Horde, but they did agree to a pact of friendship and mutual assistance.[51]
",['corruption'],"they remembered the recklessness and corruption of the first Horde. Thus,",1,0
thrall,https://wowpedia.fandom.com/wiki/Thrall,"A faction of orcs exists in Outland, who remained untouched by demonic corruption. These orcs call themselves The Mag'har, and are comprised of various orcish clans who chose not to join Magtheridon's legion of fel orcs and appear to have been completely unaffected by the corruption wrought by Kil'jaeden. Thrall sent the Horde expedition to invade Outland in order to find and reconnect with the Mag'har.[72] Upon hearing the news that the expedition found them, Thrall immediately made plans to journey to Outland and make contact with the Mag'har. Eitrigg urged Thrall to make the proper preparations, instead of leaving Orgrimmar and the rest of the orcs on Azeroth open to attack.[73]
",['corruption'],who remained untouched by demonic corruption. These orcs call themselves The | been completely unaffected by the corruption wrought by Kil'jaeden. Thrall sent,1,0
thrall,https://wowpedia.fandom.com/wiki/Thrall,"Fleeing towards Northrend, Trag Highmountain avoided his kin and tried to slip past the orcs. The corruption caused Trag to suffer from fits of violent thought, and he felt he would eventually succumb to the power of the Lich King.
","['power', 'corruption']",would eventually succumb to the power of the Lich King. | slip past the orcs. The corruption caused Trag to suffer from,2,2
thrall,https://wowpedia.fandom.com/wiki/Thrall,"Thrall along with Sylvanas and Vol'jin led the assault into Undercity itself to reclaim it for the Horde. After fighting the Forsaken rebels and the demons within, the combined might of the Horde slew the traitorous demon Varimathras. The joy of victory was short-lived as Varian, having killed Putress and hearing the orcish cries of victory, arrived on the scene. He confronted Thrall and declared that peace could never be achieved after discovering the horrors the Forsaken had created in Undercity. Just as the two forces charged at one another, Jaina stopped them from killing each other by teleporting Varian, herself and the Alliance army back to Stormwind City. As Thrall lamented on the broken peace between the Alliance and the Horde, Varok Saurfang arrived and reminded Thrall of his duty to lead their people. In order to ensure that no more Legion-aligned abominations crawled out of the Apothecarium, Thrall sent a legion of the Kor'kron led by Bragor Bloodfist to guard the Undercity from threats outside of it and any that may remain within following  [74] The Battle For The Undercity.
",['duty'],and reminded Thrall of his duty to lead their people. In,1,0
thrall,https://wowpedia.fandom.com/wiki/Thrall,"When Garrosh Hellscream and his soldiers finally returned home from Northrend, Thrall held a banquet in the young orc's honor and presented him with Gorehowl, also authorizing bonfires to be lit in Orgrimmar. Thrall held a speech of problems about the turbulence of nature and also of financial ones. It was decided that Hamuul would go to a meeting with the Cenarion Circle in order to get help for the Horde. Now, it was impossible to trade with the Alliance's night elves due to estrangement. Unfortunately Durotar had been suffering a very severe drought causing one of the bonfires to become a conflagration that destroyed several buildings. Thrall himself tried to calm the flames using his shamanic powers but found that the fire was hell-bent on destruction, resolving to snuff out the flames forcibly, an act he regretted. He realized that something was very wrong with the elements and that they were out of control, and pondered the situation.
",['power'],the flames using his shamanic powers but found that the fire,1,0
thrall,https://wowpedia.fandom.com/wiki/Thrall,"There were other troubles, such as an orc attack on a group of Sentinels in Ashenvale which was in direct violation of the Horde-Alliance treaty. The Sentinels had been skinned and then chopped up into pieces, left for carrion feeders. Whether or not they had been alive when they were skinned was debatable. The skins of the murdered night elves were hung on trees that had painted Horde symbols depicted on them; written with elven blood. Since the night elves have ceased to allow Horde members into Ashenvale in protest of the incident at the Wrathgate, many orcs celebrated this attack. With the Horde's supplies almost depleted on account of the war with the Lich King and the unusual droughts affecting Orgrimmar, many orcs viewed the night elves' exclusion of the Horde from their trade routes unfairly brutal. He received a letter from King Varian Wrynn demanding to denounce the attacks and turn over any attackers he could find to the Alliance for justice. Thrall refused to turn over violators of the treaty (he had his own suspects in mind, but lacked any proof, and he felt turning over the violates to face Alliance justice would hurt orc morale) and also refused to apologize for the thievery of the night elves' goods, the murders, or the brutal methods in which they were performed. Though he did express anger that the treaty had been violated, his unwillingness to publicly reprimand those who use brutal methods to assault Alliance members greatly weakened his popularity with Alliance leaders.
",['justice'],the violates to face Alliance justice would hurt orc morale) and | find to the Alliance for justice. Thrall refused to turn over,1,0
thrall,https://wowpedia.fandom.com/wiki/Thrall,"Thrall, the Horde's warchief, is a living symbol of nobility, strength, and unwavering courage. He led the orcs from the internment camps of Lordaeron into a new era of freedom and prosperity, and under his leadership the Horde has established itself as a major force on Azeroth. As a shaman, Thrall has a deep connection with the elements, and their wisdom has proven to be a great boon to the warchief. But although the Horde's faith in its warchief remains strong, some orcs who relish the tales of orcish ferocity and martial prowess are frustrated with Thrall's decisions. It remains to be seen whether his recent differences with Garrosh Hellscream are a one-time event or a hint at the shape of things to come.[87]
",['freedom'],"into a new era of freedom and prosperity, and under his",1,0
thrall,https://wowpedia.fandom.com/wiki/Thrall,"As one of (if not the) pre-eminent shamans of Azeroth, Thrall steps away from his duties as Warchief to join with the Earthen Ring. He journeys to  the Maelstrom at the center of the Great Sea, where Deathwing made his return to Azeroth from the depths of Deepholm. The corrupted Aspect's entry has shattered the barriers between Azeroth and the Elemental Plane, and Thrall lends his powers to stabilize the rift.
",['power'],"Plane, and Thrall lends his powers to stabilize the rift.",1,0
